title,description,text,date,language
A Crucial Clue in the $4.5 Billion Bitcoin Heist: A $500 Walmart Gift Card,"Federal investigators spent years hunting for clues in the 2016 hacking of the Bitfinex cryptocurrency exchange, when thieves stole bitcoin now worth $4.5 billion. In the end, what helped lead them to two suspects was something much more quotidian: a $500 Wal…","You have billions in bitcoin and you buy gift cads?
Sounds like parallel construction...becuase the government doesn't want anyone to know how they obtained the private key.
It's sounding more and … [+128 chars]",2022-02-17,en
Rouble-crypto trading soars as sanctions hit Russian currency - Reuters,"Trading volumes between the Russian rouble and the Tether cryptocurrency spiked sharply on Monday as the local currency tumbled to a record low on Western sanctions, data shared with Reuters showed.","LONDON, Feb 28 (Reuters) - Trading volumes between the Russian rouble and the Tether cryptocurrency spiked sharply on Monday as the local currency tumbled to a record low on Western sanctions, data s… [+1745 chars]",2022-02-28,en
El Salvador's Bukele tells bitcoin-wary U.S. senators to stay out of internal affairs - Reuters,"President Nayib Bukele on Wednesday asked U.S. senators to stay out of El Salvador's ""internal affairs"" after they called for an investigation into the economic risks the United States faces due to the Central American country's adoption of bitcoin as legal t…","MEXICO CITY, Feb 16 (Reuters) - President Nayib Bukele on Wednesday asked U.S. senators to stay out of El Salvador's ""internal affairs"" after they called for an investigation into the economic risks … [+1972 chars]",2022-02-17,en
"Mods Accused of Bitcoin Mining, Viruses Removed From Steam","Over the last few days, a series of mods for the PC strategy game Cities: Skylines have been removed from Steam after users began fearing that they contained all kinds of nasty stuff, from keyloggers to viruses to bitcoin mining software.Read more...","Over the last few days, a series of mods for the PC strategy game Cities: Skylines have been removed from Steam after users began fearing that they contained all kinds of nasty stuff, from keyloggers… [+2859 chars]",2022-02-14,en
Don’t let Reese Witherspoon make you crazy,Feeling bombarded with ads for cryptocurrency and the metaverse? You're not alone.,"Enlarge/ Actress Reese Witherspoon during an interview on Thursday, December 17, 2021.
47 with 35 posters participating
At 12:24 pm on January 11, the actor and entrepreneur Reese Witherspoon made … [+2255 chars]",2022-02-14,en
‘Heist of the century’: US bitcoin case tests ability to crack down on cybercrime,"Case may be first time government has brought a case not on the basis of an alleged theft, but on the couple’s alleged efforts to conceal their identitiesThe prosecution of a New York husband and wife arrested last week on suspicion of stealing $3.6bn in bitc…",The prosecution of a New York husband and wife arrested last week on suspicion of stealing $3.6bn in bitcoin in what has been described as the heist of the century may test US authorities ability to … [+4812 chars],2022-02-14,en
"Speculators pare bullish US dollar bets to lowest since mid-Aug -CFTC, Reuters data - Reuters","Speculators' net long positioning in the U.S. dollar dropped in the latest week to the lowest level since mid-August 2021, according to calculations by Reuters and U.S. Commodity Futures Trading Commission data released on Friday.","NEW YORK, March 4 (Reuters) - Speculators' net long positioning in the U.S. dollar dropped in the latest week to the lowest level since mid-August 2021, according to calculations by Reuters and U.S. … [+2777 chars]",2022-03-04,en
How Two 23 Year-Old Texans Made $4M Last Year Mining Bitcoin in Oil Fields,"""When Brent Whitehead and Matt Lohstroh were sophomores at Texas A&M University, they decided to get into the business of mining bitcoin on the oil fields of East Texas,"" reports CNBC:

Whitehead, an engineer hailing from a family with a long history in oil a…","Whitehead, an engineer hailing from a family with a long history in oil and gas production, and Lohstroh, a finance major with a bitcoin obsession, ignored the skeptics, and sunk all the cash they ha… [+2494 chars]",2022-02-13,en
CNN: 'Financial Sanctions are Easier Than Ever for Russians to Evade. Thank Bitcoin',"Financial sanctions are easier than ever for Russians to evade. Thank Bitcoin
CNN: 'Financial sanctions are easier than ever for Russians to evade. Thank Bitcoin'


The senior editor of CNN Business writes:
The West's initial salvo of financial sanctions agai…",The West's initial salvo of financial sanctions against Russia failed to deter President Vladimir Putin from launching a full-scale invasion of Ukraine. Now the United States is taking a punitive app… [+1369 chars],2022-02-26,en
"Most crypto investors wouldn't sell even if prices crashed 80% and nearly half have made trading a new career or are considering it, Deutsche Bank survey says",Nearly 50% of those surveyed say they have either become so successful trading crypto that they've already left their job or are considering leaving.,"A report from Deutsche Bank published this week says that the majority of crypto investors surveyed would be steadfast holders even if prices plunged dramatically. 
The findings point to a broad bul… [+1612 chars]",2022-02-15,en
Does a $3.6B Bitcoin Seizure Prove How Hard It Is to Launder Crypto?,"What's the lesson after $3.6 billion in stolen bitcoin was seized by America's Justice Department from the couple who laundering it? 

Wired argues it all just shows how hard it is to launder cryptocurrency:


In the 24 hours since, the cybersecurity world ha…",What's the lesson after $3.6 billion in stolen bitcoin was seized by America's Justice Department from the couple who laundering it?Wired argues it all just shows how hard it is to launder cryptocurr… [+2850 chars],2022-02-13,en
"From sanctions to bitcoin donations, here's how crypto is playing a major role in the Ukraine war",The various moves are a sign of the times: a 21st Century world arming itself with digital currencies in an inaugural war of the crypto age.,"The world is leveraging an unlikely weapon amid the war in Ukraine cryptocurrencies.
Ukraine's digital wallets are collecting millions to fund the country's defense; the West is weighing possible cr… [+3573 chars]",2022-02-28,en
Founder of now-defunct BitConnect has been indicted for a $2.4 billion crypto Ponzi scheme.,"BitConnect has since ceased trading and its founder, Satish Kumbhani, has been charged with a litany of crimes by a US court.","The founder of the now-obsolete cryptocurrency exchange BitConnect has been charged with organizing a $2.4 billion Ponzi scheme after a San Diego grand jury returned an indictment, according to a sta… [+2060 chars]",2022-02-28,en
Uber claiming it’ll accept Bitcoin is nothing but a marketing ploy,"One day, you may be able to pay for your Uber with Bitcoin. Or, at least, that’s what Dara Khosrowshahi, the company’s CEO, told Bloomberg.   This sounds good, but if you ask me? It’s nothing but a marketing stunt.  Before you call me biased, let’s take a clo…","One day, you may be able to pay for your Uber with Bitcoin. Or, at least, thats what Dara Khosrowshahi, the companys CEO, told Bloomberg.  
This sounds good, but if you ask me? Its nothing but a mar… [+3613 chars]",2022-02-15,en
Privacy coins are cryptocurrencies that can be traded anonymously,Privacy coins are cryptocurrencies that can be traded anonymously. They are a major issue in the debate between privacy and regulation of cryptocurrency.,"Hundreds of thousands of Bitcoin transactions happen every day. Each transaction and the people involved are recorded on Bitcoin's blockchain, viewable by anyone. Yet, let's imagine that you're buyin… [+6517 chars]",2022-02-10,en
Feds Charge Crypto-Hawking Siblings With Scamming Investors out of $124 Million,"Behold, Ormeus Coin! A glittering token, a financial wonder of the world, and yet another grand example of what cryptocurrency can offer the world.Read more...","Behold, Ormeus Coin! A glittering token, a financial wonder of the world, and yet another grand example of what cryptocurrency can offer the world.
...Or, as federal officials see it, a massive scam… [+2480 chars]",2022-03-08,en
Conti Ransomware Gang Sees Thousands of Internal Chats Leaked After Posting Pro-Russia Message,Members of the Conti ransomware gang are now being attacked by one of their own. An insider from the gang has leaked a massive cache of internal chats after its leaders took an aggressive pro-Russian stance on their public site.Read more...,Members of the Conti ransomware gang are now being attacked by one of their own. An insider from the gang has leaked a massive cache of internal chats after its leaders took an aggressive pro-Russian… [+2059 chars],2022-02-28,en
Twitter’s accepting tips in Ethereum — and Dorsey must be fuming,"Last night, Twitter announced it’ll allow users to tip accounts via Ethereum. This is the social network’s second crypto announcement in two months, after it enabled NFT-based profile pictures in January. These developments have come after Jack Dorsey stepped…","Last night, Twitter announced itll allow users to tip accounts via Ethereum.
This is the social networks second crypto announcement in two months, after it enabled NFT-based profile pictures in Janu… [+5114 chars]",2022-02-17,en
"Biden to Feds: Figure Out This Crypto Thing, Stat","Joe Biden is dipping his toes into crypto. On Wednesday, the president signed a first-of-its-kind executive order outlining a path to regulation of cryptocurrencies and encouraging federal agencies to study the creation of a U.S. digital dollar on the blockch…","Joe Biden is dipping his toes into crypto. On Wednesday, the president signed a first-of-its-kind executive order outlining a path to regulation of cryptocurrencies and encouraging federal agencies t… [+2590 chars]",2022-03-09,en
Inside the Chess Match That Led the Feds to $3.6 Billion in Stolen Bitcoin,The anatomy of the DOJ operation to seize $3.6 billion Bitcoin stolen in the Bitfinex hack is a cautionary tale in an era of rapid blockchain ascendancy.,"A version of this article was published in TIME’s newsletter Into the Metaverse. Subscribe for a weekly guide to the future of the Internet. You can find past issues of the newsletter here.
It’s the… [+10031 chars]",2022-02-10,en
"US dollar net long bets skid to lowest since mid-August 2021 -CFTC, Reuters - Reuters","Speculators' net long positioning in the U.S. dollar dropped in the latest week to its lowest since mid-August 2021, according to calculations by Reuters and U.S. Commodity Futures Trading Commission data released on Friday.","NEW YORK, Feb 11 (Reuters) - Speculators' net long positioning in the U.S. dollar dropped in the latest week to its lowest since mid-August 2021, according to calculations by Reuters and U.S. Commodi… [+3287 chars]",2022-02-11,en
BitConnect Founder Indicted Over $2.4 Billion Cryptocurrency Ponzi Scheme,"From the Hindustan Times:
BitConnect founder Satish Kumbhani was indicted by a U.S. grand jury on charges he orchestrated a global Ponzi scheme that raised $2.4 billion from investors in a fraudulent cryptocurrency investment platform, according to a Justice …","Investors around the world, including those in San Diego, were encouraged to buy BitConnect's open-source, decentralized cryptocurrency, called BCC, using Bitcoin for the purchase. Investors would th… [+1311 chars]",2022-02-27,en
"Unlike in Miami, residents of New York City can't trade their namesake cryptocurrency","New Yorkers can only mine — not buy and sell — the city's namesake token because exchanges offering the coin don't have a BitLicense, Bloomberg said.","New York wants to compete with Miami as the US crypto hub, but its residents can't even trade the city's namesake digital token.
According to a report from Bloomberg News, New Yorkers can only mine … [+1448 chars]",2022-02-28,en
BitMEX co-founder must face criminal trial in anti-money laundering case - Reuters,"A federal judge in Manhattan denied BitMEX co-founder Samuel Reed's motion to dismiss criminal charges against him on Monday, days after two other co-founders of the cryptocurrency exchange pleaded guilty to violating U.S. anti-money laundering rules.","<ul><li>
Summary</li><li>
Law firms</li><li>
Related documents</li></ul>
The company and law firm names shown above are generated automatically based on the text of the article. We are improving … [+2465 chars]",2022-02-28,en
Ukraine to issue non-fungible tokens to fund armed forces,"Announcement by vice-prime minister follows appeal for cryptocurrency donations that has raised £38mUkraine has announced it will issue non-fungible tokens to fund its armed forces, as cryptocurrency becomes an increasingly popular means of giving support to …","Ukraine has announced it will issue non-fungible tokens to fund its armed forces, as cryptocurrency becomes an increasingly popular means of giving support to the government in Kyiv.
Mykhailo Fedoro… [+3251 chars]",2022-03-03,en
"The rise of crypto on Wall Street could end up triggering another financial crisis, global watchdog warns","If financial institutions become more involved in crypto markets, it could affect their balance sheets and liquidity in unexpected ways, the FSB said.","Wall Street institutions' growing connections to crypto markets could threaten financial stability and cause a credit crunch-style financial crisis, global regulators have warned.
The Financial Stab… [+2875 chars]",2022-02-17,en
A viral YouTube takedown of NFTs has already clocked over 5 million views: Here are the biggest revelations,"NFTs and cryptocurrency are a ""bigger fool scam,"" according to a rigorous new takedown video from Canadian YouTuber Dan Olson.","At over two hours long, the wildly popular new YouTube documentary  ""Line Goes Up The Problem With NFTs"" is an exhaustive takedown of the hot new investment vehicle that everyone from Waka Flacka Fla… [+2929 chars]",2022-02-18,en
"Market Uncertainty Causes Metal Prices to Spike, Raises Questions Over Cryptocurrency's Worth",Gold is hitting prices unseen since August 2020.,"The uncertainty of the market has put gold on track to hit $2,000 per ounce on Monday, reaching levels unseen since August 2020. Palladium, another metal considered a hedge for inflation, reached an … [+1664 chars]",2022-03-07,en
UK Intelligence Agencies Are Investigating Cryptocurrency Transactions,"MattSparkes writes: Bitstamp, Europe's largest cryptocurrency exchange, says it has handed over information on some of its customers to the UK's intelligence agencies, MI5 and MI6. The news suggests that bitcoin and other cryptocurrencies are being used in se…","Bitstamp, Europe's largest cryptocurrency exchange, says it has handed over information on some of its customers to the UK's intelligence agencies, MI5 and MI6. The news suggests that bitcoin and oth… [+470 chars]",2022-02-25,en
Dow surges 600 points as oil prices pull back from 14-year highs,The S&P 500 Energy index has shot up about 40% so far in 2022 as oil prices surge on the back of Russia's invasion of Ukraine.,"US stocks rose Wednesday, with equities finding some relief as prices for oil that recently have been propelled higher on the back of Russia's invasion of Ukraine oil prices moved lower. 
The S&amp;… [+1476 chars]",2022-03-09,en
"Bitcoin, Dogecoin, Shiba Inu and other cryptocurrencies get clobbered. Blame Putin","Far from being a safe bet in risky times, cryptocurrencies are volatile to geopolitical tensions.
Cryptocurrencies around the world are getting pummeled today. A quick glance at CoinDesk’s tracker will show you a wall of red. At the time of this writing, most…","Cryptocurrencies around the world are getting pummeled today. A quick glance at CoinDesk’s tracker will show you a wall of red. At the time of this writing, most major cryptocurrencies are down at le… [+1204 chars]",2022-02-18,en
"Gold hits 20-month high as Russia launches 'full-scale' invasion of Ukraine, bitcoin plunges - Kitco NEWS","<ol><li>Gold hits 20-month high as Russia launches 'full-scale' invasion of Ukraine, bitcoin plunges  Kitco NEWS
</li><li>Oil heads higher as Ukraine tensions escalate — price depends on what happens next  CBC.ca
</li><li>Oil Prices Top $100 A Barrel While …","Gold and oil are up sharply after recent reports that the Russia-Ukraine conflict is intensifying. 
Spot gold crested $1,940 an ounce Wednesday evening eastern time, its highest level since June 202… [+1320 chars]",2022-02-24,en
What Is USDT and When to Invest in It?,"Over the last few years, cryptocurrencies have entered the mainstream. People are now showing interest in subjects within the crypto ecosystem, like stablecoins, altcoins (altcoins is merely any coin other than bitcoin) — yielding, farming, and so on. Tether,…","Over the last few years, cryptocurrencies have entered the mainstream. People are now showing interest in subjects within the crypto ecosystem, like stablecoins, altcoins (altcoins is merely any coin… [+12050 chars]",2022-03-08,en
Blockchain for Jobs Future: Benefits and Jobs Opportunities Explained,"Right now, there’s a lot of talk about the Blockchain and how it will change the world as we know it. However, many people are still trying to understand what the Blockchain is and how it works. But one thing is for sure- the Blockchain is here to stay. And w…","Right now, theres a lot of talk about the Blockchain and how it will change the world as we know it. However, many people are still trying to understand what the Blockchain is and how it works.
But … [+10990 chars]",2022-03-03,en
The CIA Has Secretly Run a “Bulk Collection” Program,"Plus: Vulnerability fixes, the return of EARN IT, and more of the week’s top security news.","Cryptocurrency was everywhere this week, funding anti-Russian resistance groups and hacktivists in Ukraine and being seized by the US Department of Justice in a massive trove of laundered bitcoin wor… [+4501 chars]",2022-02-12,en
Ukraine Receives $42M in Cryptocurrency Donations - Plus 180 NFTs They Didn't Ask For,"Thursday the Washington Post reported the Ukrainian government had already received more than $42 million in cryptocurrency donations since last Saturday — ""plus digital artwork including a limited edition worth roughly $200,000,"" according to blockchain anal…","Some of the crypto donations have already been converted into traditional currency, primarily euros, according to Kuna.io, the Kyiv-based cryptocurrency exchange that helped the government set up and… [+2656 chars]",2022-03-05,en
Pornhub and the Value of Bitcoin,"In December 2020, Visa, Mastercard, and Discover stopped processing payments for Pornhub, a website based in Canada that allows users around the world to upload","10 PagesPosted: 19 Feb 2022
Date Written: February 16, 2022
Abstract
In December 2020, Visa, Mastercard, and Discover stopped processing payments for Pornhub, a website based in Canada that allows… [+460 chars]",2022-03-08,en
"Someone Bought NFTs From Accused Bitcoin Launderer, And They're Pissed",The NFTs previously owned by accused Bitcoin launderer Heather Morgan are no longer visible on OpenSea.,The world was shocked this week by the allegations against a terminally online husband and wife for successfully laundering stolen bitcoins worth $1 billion and conspiracy to launder nearly $4 billio… [+3529 chars],2022-02-10,en
Coinbase shares slip as app crashes briefly after Super Bowl ad - Reuters,"Shares of the largest publicly listed U.S. crypto exchange Coinbase <a href=""https://www.reuters.com/companies/COIN.O"" target=""_blank"">(COIN.O)</a> slipped in premarket trading on Monday, after a surge in traffic following a Super Bowl advertisement resulted …","Feb 14 (Reuters) - Shares of the largest publicly listed U.S. crypto exchange Coinbase (COIN.O) slipped in premarket trading on Monday, after a surge in traffic following a Super Bowl advertisement r… [+1179 chars]",2022-02-14,en
Coinbase to let crypto recipients in Mexico cash out in local currency - Reuters,"Coinbase Global <a href=""https://www.reuters.com/companies/COIN.O"" target=""_blank"">(COIN.O)</a> on Tuesday said it is launching a pilot program to allow cryptocurrency recipients in Mexico to cash out their funds in pesos, a move aimed at shaking up the $700 …","Feb 15 (Reuters) - Coinbase Global (COIN.O) on Tuesday said it is launching a pilot program to allow cryptocurrency recipients in Mexico to cash out their funds in pesos, a move aimed at shaking up t… [+980 chars]",2022-02-15,en
Thailand approves relaxed tax rules for digital assets - Reuters,Thailand's cabinet on Tuesday relaxed tax rules for investments in digital assets to help promote and develop the industry following a surge in cryptocurrency trading in Southeast Asia's second-largest economy.,"BANGKOK, March 8 (Reuters) - Thailand's cabinet on Tuesday relaxed tax rules for investments in digital assets to help promote and develop the industry following a surge in cryptocurrency trading in … [+1316 chars]",2022-03-08,en
EU checking if cryptoassets being used to bust Russian sanctions - EU official - Reuters,"The European Commission is studying whether cryptoassets are being used to get round financial sanctions imposed on Russian banks following the country's invasion of Ukraine, a senior European Union official said on Wednesday.","Representations of cryptocurrencies Bitcoin, Ethereum, DogeCoin, Ripple, and Litecoin are seen in front of a displayed Binance logo in this illustration taken, June 28, 2021. REUTERS/Dado Ruvic/Illus… [+1327 chars]",2022-03-02,en
Ex-Canadian government official extradited to face charges over ransomware attacks - Reuters.com,"A former Canadian government official has been extradited to the United States to face criminal charges alleging he deployed ransomware known as ""NetWalker"" to target companies, municipalities, hospitals and law enforcement during the height of the COVID-19 p…","WASHINGTON, March 10 (Reuters) - A former Canadian government official has been extradited to the United States to face criminal charges alleging he deployed ransomware known as ""NetWalker"" to target… [+1388 chars]",2022-03-10,en
Bitcoin vs. Bitcoin Cash: What's the Difference?,"Bitcoin Cash sounds like a contradiction—and what does it have to do with Bitcoin, anyway?","Almost everyone has heard about Bitcoin, the world's first and most valuable cryptocurrency. But you may have also heard of Bitcoin Cash, another popular and valuable currency that now has a solid fo… [+6887 chars]",2022-02-14,en
Tech Companies’ Super Bowl Ads Leaned Into Dystopia,"If Sunday night’s Big Game commercials had any message, it was that corporations have a disconcerting vision for our future.","Super Bowl commercials, in advertising lore, are the holy grail: a chance for a company to pitch itself to tens of millions of people all at once. Its a real best-foot-forward scenario. But during Su… [+4953 chars]",2022-02-14,en
"US banks, Costco, Sweetgreen - Reuters.com","U.S. stock index futures cut some losses on Friday after data pointed to solid jobs growth in February, although lingering concerns about the Ukraine conflict weighed on sentiment.","U.S. stock index futures cut some losses on Friday after data pointed to solid jobs growth in February, although lingering concerns about the Ukraine conflict weighed on sentiment.
At 8:57 ET, Dow e… [+3382 chars]",2022-03-04,en
"Ukraine is asking for dogecoin donations, preferring the joke coin over less valuable rubles","Dogecoin is now worth more than rubles, according to Ukraine's Vice Prime Minister Mykhailo Fedorov, who announced today that Ukraine is accepting donations of the memecoin to help fight against Russia.



""Now even meme can support our army and save lives fr…","Dogecoin is now worth more than rubles, according to Ukraine's Vice Prime Minister Mykhailo Fedorov, who announced today that Ukraine is accepting donations of the memecoin to help fight against Russ… [+1979 chars]",2022-03-02,en
"More Than Half of Bitcoin Investors Are in the Red, Study Says","Most Bitcoin investors have actually lost money on the cryptocurrency so far, according to one blockchain analysis.","The internet abounds in tales of overnight crypto millionaires. But making a killing – or even any money at all may be a lot harder than it looks. Just how hard? According to one recent estimate, mor… [+1907 chars]",2022-02-13,en
"Ontario court freezes millions in cash, cryptocurrency donated to Ottawa protesters - The Globe and Mail","<ol><li>Ontario court freezes millions in cash, cryptocurrency donated to Ottawa protesters  The Globe and Mail
</li><li>More than 130 Prince George residents donated to Freedom Convoy, according to hacked document  Prince George Citizen
</li><li>More than …","Trucks participate in a blockade near the parliament building as a demonstration organized by truck drivers opposing vaccine mandates continues on Feb. 17.Scott Olson/Getty Images North America
An O… [+5984 chars]",2022-02-18,en
