title,description,text,date,language
Netflix is already making a docuseries about the alleged billion-dollar bitcoin launderers,"Netflix
 is making a docuseries about one of the worst rappers of all time
. Coincidentally, Heather ""Razzlekhan"" Morgan and her husband, Ilya Lichtenstein, were charged this week with conspiring to launder 119,754 bitcoin, which was stolen in the 2016 hack…","Netflix
 is making a docuseries about one of the worst rappers of all time
. Coincidentally, Heather ""Razzlekhan"" Morgan and her husband, Ilya Lichtenstein, were charged this week with conspiring t… [+1432 chars]",2022-02-11,en
Justice Dept. Announces Raft of Changes Meant to Deter Cyberthreats,"The moves came a week after the department made its largest financial seizure ever, confiscating over $3.6 billion worth of Bitcoin stolen in a 2016 hacking.","Even in cyberspace, the Department of Justice is able to use a tried and true investigative technique, following the money, Ms. Monaco said. Its what led us to Al Capone in the 30s. It helped us dest… [+1176 chars]",2022-02-17,en
Inside Heather Morgan and Ilya Lichtenstein's Confounding Bitcoin Case,The arrests of Ilya Lichtenstein and Heather Morgan left the world of cryptocurrency incredulous: Could this goofy young couple have been Bitcoin’s Bonnie and Clyde?,"The couple would never flee from the country at the risk of losing access to their ability to have children, the lawyer wrote.
At the hearing, a prosecutor, Margaret Lynaugh, said in opposing bail f… [+1600 chars]",2022-02-13,en
"Super Bowl Crypto Ads Feature Larry David, LeBron James, and QR Code for Free Bitcoin","If Sunday’s Super Bowl ads are any indication, crypto has truly arrived in mainstream culture. And if you didn’t catch the game, you can watch the ads here, featuring Larry David, LeBron James, and a QR code that crashed Coinbase’s website within minutes.Read…","If Sundays Super Bowl ads are any indication, crypto has truly arrived in mainstream culture. And if you didnt catch the game, you can watch the ads here, featuring Larry David, LeBron James, and a Q… [+3454 chars]",2022-02-14,en
It Only Took 3 Days for Netflix to Order a Docuseries on the Bonnie and Clyde of the Crypto World,"The news of one of the biggest money laundering schemes in history captivated the world on Tuesday, not so much because of the crime—which involved $4.5 billion in bitcoin and is, yeah, a big deal—but rather because of the couple accused of carrying it out. T…","The news of one of the biggest money laundering schemes in history captivated the world on Tuesday, not so much because of the crimewhich involved $4.5 billion in bitcoin and is, yeah, a big dealbut … [+1948 chars]",2022-02-12,en
Ilya Lichtenstein Held in Bitcoin Case While Heather Morgan Is Given Bail,"A judge appeared more concerned by the flight risk posed by Ilya Lichtenstein than by his wife, Heather Morgan, in a case accusing them of a sweeping scheme to launder stolen cryptocurrency.","The confiscation of the Bitcoin that remained in Mr. Lichtensteins wallet on Feb. 1, worth roughly $3.6 billion at the time, was the Justice Departments largest financial seizure ever, officials have… [+1442 chars]",2022-02-15,en
Playing With Crypto? You’ll Need a Wallet (or Several),Buying and selling NFTs or transferring digital currency is going to require a little leap of faith. Here’s how to get started.,"If people who buy cryptocurrencies intended only to hold on to them as speculative investments, there'd be no real need for crypto wallets. Exchanges and online brokerages that convert dollars to, sa… [+3031 chars]",2022-02-10,en
CRYPTOVERSE-Bitcoin could be laid low by miners' malady - Reuters,Bitcoin miners are feeling the heat - and the pain's rippling downstream to pressure prices.,"Feb 22 (Reuters) - Bitcoin miners are feeling the heat - and the pain's rippling downstream to pressure prices.
The cryptocurrency's spectacular rally in 2021 drew thousands of entrants into mining,… [+4196 chars]",2022-02-22,en
Cryptoverse: Bitcoin gains conflict currency credentials - Reuters,"Bitcoin has leapt since Russia's invasion of Ukraine, bolstered by people in those countries looking to store and move money in anonymous and decentralised crypto.","March 1 (Reuters) - Bitcoin has leapt since Russia's invasion of Ukraine, bolstered by people in those countries looking to store and move money in anonymous and decentralised crypto.
Bitcoin tradin… [+3955 chars]",2022-03-01,en
War Is Calling Crypto’s ‘Neutrality’ Into Question,War in Ukraine and Western sanctions against Russia have made cryptocurrency a hot potato for international politics.,"Whose side is cryptocurrency on? If you had asked Satoshi Nakamoto, the pseudonymous person (or persons) who created the Bitcoin platform in 2008, he/they likely would have rejected the question. The… [+3643 chars]",2022-03-08,en
Cryptocurrency Donations Pour Into Ukraine. This Week in Bitcoin and Crypto News - CNET,"Nonfungible Tidbits: All the bitcoin, cryptocurrency and NFT news for the week ending March 6.","Getty
Welcome to Nonfungible Tidbits. Our focus this week: Russia's war in Ukraine. 
In addition to uprooting the lives of Ukrainians and throwing the international order into chaos, the Russian in… [+3275 chars]",2022-03-05,en
Influencers beware: promoting the wrong crypto could mean facing a class-action lawsuit,An appeals court ruled that promoting unregistered securities on YouTube is the same as doing it in a targeted letter. Now a lawsuit against promoters of the BitConnect crypto Ponzi scheme will continue.,"An appeals court decided shilling for an unregistered security on YouTube is the same thing as doing it in a letter.
Illustration by Alex Castro / The Verge
The story of BitConnect doesnt include a… [+3046 chars]",2022-02-19,en
Bitcoin and Ether Are Helping Fund Ukraine's Resistance - CNET,Nearly $20 million has been raised in cryptocurrencies like bitcoin and ether since Russian forces invaded Ukraine last week.,"Nurphoto/Getty
As Russia launched an invasion into his home country last Thursday, Ukranian photographer Vitaliy Raskalov found himself a world away in Mexico City. When I spoke with him over Telegr… [+7815 chars]",2022-02-28,en
CRYPTOVERSE-Bitcoin runs into Russian rules and regiments - Reuters,Bristling tensions and looming laws in Europe could offer clues to two questions: Can bitcoin be a safe-haven asset? And can Russia emerge as a crypto superpower?,"Feb 15 (Reuters) - Bristling tensions and looming laws in Europe could offer clues to two questions: Can bitcoin be a safe-haven asset? And can Russia emerge as a crypto superpower?
The answer to th… [+4123 chars]",2022-02-15,en
Cryptocurrencies in a time of war - Reuters.com,"Cryptocurrencies have been close to the headlines since Russia invaded Ukraine, with the ever-volatile bitcoin in demand in Russia and beyond.","LONDON, March 4 (Reuters) - Cryptocurrencies have been close to the headlines since Russia invaded Ukraine, with the ever-volatile bitcoin in demand in Russia and beyond.
Here are some charts that l… [+3634 chars]",2022-03-04,en
Wall St Week Ahead Crypto investors face more uncertainty after rocky start to 2022 - Reuters,"Investors are bracing for more gyrations in bitcoin and other cryptocurrencies, as worries over a hawkish Federal Reserve threaten to squelch risk appetite across markets.","NEW YORK, Feb 11 (Reuters) - Investors are bracing for more gyrations in bitcoin and other cryptocurrencies, as worries over a hawkish Federal Reserve threaten to squelch risk appetite across markets… [+5024 chars]",2022-02-11,en
Intel launches blockchain chip to tap crypto boom - Reuters,Intel Corp on Friday launched a new chip for blockchain applications such as Bitcoin mining and minting NFTs to cash in on the rising usage of cryptocurrencies.,"Feb 11 (Reuters) - Intel Corp on Friday launched a new chip for blockchain applications such as Bitcoin mining and minting NFTs to cash in on the rising usage of cryptocurrencies.
The chip will ship… [+1192 chars]",2022-02-11,en
"LIVE MARKETS Bitcoin, not exactly a safe haven today - Reuters","Welcome to the home for real-time coverage of markets brought to you by Reuters reporters. You can share your thoughts with us at <a href=""mailto:markets.research@thomsonreuters.com"" target=""_blank"">markets.research@thomsonreuters.com</a>","Feb 24 - Welcome to the home for real-time coverage of markets brought to you by Reuters reporters. You can share your thoughts with us at markets.research@thomsonreuters.com
BITCOIN, NOT EXACTLY A … [+6882 chars]",2022-02-24,en
"Ukraine asking for bitcoin donations is bullish for the cryptocurrency, veteran strategist Tom Lee says","""Still think bitcoin is not useful?"" Fundstrat's Tom Lee wrote in a note to clients, after Ukraine asked for donations.","The Ukrainian government asking for donations in bitcoin shows the utility of the cryptocurrency and is a positive sign for the market, veteran strategist Tom Lee has said.
Ukraine government accoun… [+1750 chars]",2022-03-01,en
The Beginner’s Guide to Learning to Trade in Bitcoin,"2021 was a year of significant highs and lows for crypto investors. As the market fluctuates, the curiosity surrounding crypto trading looms large. As a result, it will be worthwhile learning how to trade in Bitcoin. Suppose you are feeling overwhelmed with t…","2021 was a year of significant highs and lows for crypto investors. As the market fluctuates, the curiosity surrounding crypto trading looms large. As a result, it will be worthwhile learning how to … [+5479 chars]",2022-02-11,en
Twitter aims for edge in Big Tech's crypto contest with OpenNode investment,Twitter invested an undisclosed sum in OpenNode's $20 million funding round that valued the Bitcoin payments provider at $220 million.,"The news: Tech heavyweight Twitter invested an undisclosed sum in OpenNode's $20 million funding round that valued the Bitcoin payments provider at $220 million, per CoinDesk.
Insider Intelligence
… [+2696 chars]",2022-02-11,en
"'Shark Tank' investor Kevin O'Leary says bitcoin won't hit $300,000 until institutions are comfortable buying the crypto","""If you want to talk about bitcoin going to $100,000, $200,000, $300,000, it's going to be when institutions can finally buy it,"" O'Leary said.","Don't expect bitcoin to double or triple in price anytime soon, going by ""Shark Tank"" investor Kevin O'Leary's prediction.
""If you want to talk about bitcoin going to $100,000, $200,000, $300,000, i… [+2200 chars]",2022-02-18,en
"Cryptocurrencies rebound, with bitcoin rising as much as 14%, as Russian and Ukrainian buyers pile in","As the ruble crumbles, Russian buyers have flocked to bitcoin, while millions of dollars in crypto donations are going to Ukraine.","Bitcoin rallied to a two-week high on Tuesday in spite of the turmoil on the broader markets, thanks to a surge in buying by Russians and Ukrainians who may be seeking refuge in cryptocurrencies as t… [+2894 chars]",2022-03-01,en
Bukele to propose granting Salvadoran citizenship to foreign investors - Reuters,El Salvador President Nayib Bukele on Sunday said he will send Congress a proposal to grant citizenship to foreigners who invest in the Central American country as well as other initiatives to reduce government hurdles in order to attract investment projects.,"SAN SALVADOR, Feb 20 (Reuters) - El Salvador President Nayib Bukele on Sunday said he will send Congress a proposal to grant citizenship to foreigners who invest in the Central American country as we… [+1144 chars]",2022-02-20,en
Verdict against self-proclaimed Bitcoin inventor balloons to $143 mln - Reuters.com,"Self-proclaimed Bitcoin creator Craig Wright must pay another $43 million to a joint venture he co-created, adding to a $100 million verdict against him last year, a federal judge in West Palm Beach, Florida, ruled Wednesday.","<ul><li>
Summary</li><li>
Law firms</li><li>
Related documents</li></ul>
The company and law firm names shown above are generated automatically based on the text of the article. We are improving … [+2414 chars]",2022-03-10,en
Bitcoin paradise? Briton creates ‘crypto utopia’ in South Pacific,Anthony Welch and partner try to woo cryptocurrency investors to regulation-free island on Vanuatu archipelagoFor the past 12 years Anthony Welch and his partner Theresa have been living a Robinson Crusoe life alone on a South Pacific island mostly untouched …,"For the past 12 years Anthony Welch and his partner Theresa have been living a Robinson Crusoe life alone on a South Pacific island mostly untouched by humanity.
Welch, a retired British property in… [+8671 chars]",2022-02-12,en
Canada Declares National Emergency to End Trucker Protests,"The extraordinary move allows the police to seize trucks used in blockades. And the government will formally ban demonstrations in areas like border crossings, airports and Ottawa, the country’s capital.","New details about the source of millions of dollars supporting the Canadian trucker convoy suggest many of the larger donors are wealthy Canadians, though one of the biggest contributions was made in… [+5139 chars]",2022-02-15,en
BitConnect founder indicted by Justice Department has disappeared,"SEC officials do not know the whereabouts of Satish Kumbhani, the founder of crypto trading platform BitConnect, who was charged
 last week with defrauding investors of $2.4 billion in a Ponzi scheme. This puts the SEC in quite a bind, since they have to ser…","SEC officials do not know the whereabouts of Satish Kumbhani, the founder of crypto trading platform BitConnect, who was charged
 last week with defrauding investors of $2.4 billion in a Ponzi schem… [+2634 chars]",2022-03-02,en
How Ukrainians are fundraising in cryptocurrency,Millions of dollars of cryptocurrency have flowed into Ukraine after it was attacked by Russia. Crypto was already popular — and proponents say it gets donations to those in need faster.,"Illustration by James Bareham / The Verge

 


 More than $15 million has been donated so far More than $15 million in cryptocurrency has been donated to Ukrainian groups since Russia attacked the c… [+7442 chars]",2022-02-26,en
Bitcoin miners revived a dying fossil fuel plant – then CO2 emissions soared,Critics say the enormous electricity consumption needed to sustain cryptocurrency is fueling the climate crisis and now threatens a partial resurrection of coal in the USEnvironmentalists in Montana called it the “death watch”. Following years of financial lo…,"Environmentalists in Montana called it the death watch. Following years of financial losses one of the handful of remaining coal-fired power plants in the state appeared doomed, its likely fate offer… [+8060 chars]",2022-02-18,en
"Block beats profit estimates as Square, Cash App record growth - Reuters","Payments platform Block Inc <a href=""https://www.reuters.com/companies/SQ.N"" target=""_blank"">(SQ.N)</a> beat profit estimates on Thursday, as busier trading in bitcoin softened the blow from declining growth in digital commerce.","Feb 24 (Reuters) - Payments platform Block Inc (SQ.N) beat profit estimates on Thursday, as busier trading in bitcoin softened the blow from declining growth in digital commerce.
Block, which change… [+1827 chars]",2022-02-25,en
"Ukrainian volunteer group raises $4 mln in bitcoin since Russian invasion, research shows - Reuters","A Ukrainian volunteer group that provides equipment to the country's army has received over $4 million in bitcoin donations since Russia launched its invasion on Thursday, according to blockchain analysis firm Elliptic.","LONDON, Feb 25 (Reuters) - A Ukrainian volunteer group that provides equipment to the country's army has received over $4 million in bitcoin donations since Russia launched its invasion on Thursday, … [+1935 chars]",2022-02-25,en
Ukraine's government raises crypto worth $8 million in crowdfunding appeal - Reuters,"Ukraine's government has raised almost $8 million in cryptocurrencies after posting appeals on social media for donations of bitcoin and other digital tokens, according to blockchain analysis company Elliptic.","LONDON, Feb 27 (Reuters) - Ukraine's government has raised almost $8 million in cryptocurrencies after posting appeals on social media for donations of bitcoin and other digital tokens, according to … [+1859 chars]",2022-02-27,en
Bitcoin Skyrockets After Biden Sign Executive Order to Regulate Crypto,The legislature is the first of its kind.,"One of the biggest criticisms of cryptocurrency at large (particularly the ever-popular Bitcoin) is that theres no market regulation, which creates an extremely volatile market.
Ting Shen/Bloomberg … [+2184 chars]",2022-03-10,en
"Colorado will accept crypto for payment of state taxes by the summer, with drivers' and hunting licenses to follow, Gov. Polis says","But the state of Colorado won't hold ethereum or bitcoin, as it isn't permitted to do so, Gov. Jared Polis told CNBC.","People in Colorado will be able to pay their state taxes in cryptocurrency by the middle of this year, the US state's governor has revealed.
Gov. Jared Polis laid out the timing of the move, a longt… [+2206 chars]",2022-02-16,en
"Bitcoin is shaping up to enter a bear market and likely won't recover until 2025, co-founder of Huobi crypto exchange says","""Following this cycle, it won't be until end of 2024 to beginning of 2025 that we can welcome next bull market on bitcoin,"" Du Jun said.","Bitcoin is likely entering a 
bear market, and the next major rally probably won't come until late 2024 or early 2025, according to the co-founder of one of the world's biggest crypto exchanges.
Hu… [+2166 chars]",2022-02-21,en
"Bitcoin donations to Ukraine's army surge as Russian forces roll in, with $3 million coming from just a single giver","A Ukrainian NGO raised over $4 million in bitcoin for the country's army since Russia attacked, with one donor giving $3 million, Elliptic said.","A Ukrainian nonprofit has raised bitcoin worth more than $4 million to support the country's army since Russia attacked, according to blockchain analytics company Elliptic.
Come Back Alive a charita… [+2415 chars]",2022-02-25,en
"Bitcoin's strength is being driven by Russians choosing the crypto as an avenue to move their wealth out of the country, legendary investor Mark Mobius says","""That's the reason why bitcoin is showing strength now, because the Russians have a way of getting their wealth out,"" Mobius said Tuesday.","Bitcoin's rally is being driven by Russians wanting to store their wealth somewhere safe, according to legendary investor Mark Mobius.
After Russia invaded Ukraine on Thursday, the US and its allies… [+2224 chars]",2022-03-01,en
Coinbase earnings show trading of ethereum and altcoins surged in 2021 as bitcoin volume cooled,"Ethereum trading volume increased from 15% to 21% of Coinbase's total, and altcoins increased from 44% to 55%. Bitcoin dropped from 41% to 24%.","Coinbase reported that the share of trading volume for ethereum and other altcoins increased last year, while bitcoin's share dropped dramatically. 
Between 2020 and 2021, ethereum trading volume in… [+1187 chars]",2022-02-25,en
"FTX.US boss predicts ethereum and altcoins will eat away at bitcoin's market dominance, thanks to their proof-of-stake system","""Over time, we're just going to see less and less of the total market share come from just one asset, from bitcoin alone,"" FTX.US' president Brett Harrison said.","Bitcoin's dominance in cryptocurrencies will dwindle as tokens using a proof-of-stake system eat away at its market share, FTX.US boss Brett Harrison has predicted.
Bitcoin's grip is loosening as th… [+3022 chars]",2022-02-15,en
Could Putin be exploring cryptocurrencies to bypass western sanctions?,Debate rages over whether Russian banks could use crypto such as bitcoin as an alternative currency exchange<ul><li>Russia-Ukraine crisis: live news</li><li>Jim O’Neill: Putin’s errors could herald big change for global finance</li></ul>As many people do when…,"As many people do when discussing the complex world of cryptocurrencies, Vladimir Putin kept it simple: Of course, we also have certain competitive advantages here, especially in the so-called mining… [+6981 chars]",2022-03-01,en
Ruby On Rails Creator Backpedals About Bitcoin: 'We Need Crypto',"New submitter LZ_Mordan writes: David Heinemeier Hansson, the Ruby on Rails web development framework creator, took to Twitter on Monday to tell his followers that he was no longer a Bitcoin skeptic. ""I still can't believe that this is the protest that would …","David Heinemeier Hansson, the Ruby on Rails web development framework creator, took to Twitter on Monday to tell his followers that he was no longer a Bitcoin skeptic. ""I still can't believe that thi… [+1121 chars]",2022-02-22,en
Bitcoin jumps after apparent Yellen statement quells U.S. clampdown fears - Reuters.com,Bitcoin led a rally in cryptocurrencies on Wednesday after what appeared to be a prematurely published U.S. Treasury statement allayed market worries about a sudden tightening of U.S. rules around digital assets.,"TOKYO, March 9 (Reuters) - Bitcoin led a rally in cryptocurrencies on Wednesday after what appeared to be a prematurely published U.S. Treasury statement allayed market worries about a sudden tighten… [+1787 chars]",2022-03-09,en
"Bitcoin rises to top $42,000 as Biden shares his plan for cryptocurrencies, after spiking thanks to Janet Yellen leaking details","Biden's anticipated executive order on cryptocurrency will be released this week and key details have now come out, pushing bitcoin higher.","Bitcoin rose above $40,000 on Wednesday as US Treasury Secretary Janet Yellen accidentally revealed details of President Biden's impending crypto order, which was later followed by a fact sheet confi… [+2833 chars]",2022-03-09,en
"Bitcoin Plummets Below $40,000 as Tensions Between Russia, Ukraine Escalate",The coin dropped over 6% early Tuesday morning.,"Bitcoin plummeted early this week amid escalating tensions and word of mobilization into Ukraine by Russian troops.
The coin dropped below $40,000 in valuation over the weekend and then fell about 6… [+1816 chars]",2022-02-22,en
"Weekend: Marina Hyde, Charlie Brooker and voice note etiquette","In this week’s episode, Marina Hyde on oligarchs in London (1m35s), Zoe Williams interviews Charlie Brooker (9m07s), Annie Lord discusses the pros and cons of voice notes (19m11s) and Luke Winkie investigates the Crime Queen of Bitcoin (31m45s). Continue read…","In this weeks episode, Marina Hyde on oligarchs in London (1m35s), Zoe Williams interviews Charlie Brooker (9m07s), Annie Lord discusses the pros and cons of voice notes (19m11s) and Luke Winkie inve… [+100 chars]",2022-02-26,en
Is crypto winter over? Bitcoin price jumps toward $45k as safe-haven appeal returns to digital assets - Kitco NEWS,"<ol><li>Is crypto winter over? Bitcoin price jumps toward $45k as safe-haven appeal returns to digital assets  Kitco NEWS
</li><li>Some big cryptocurrency exchanges won't bar Russians, raising fears of sanctions backdoor  The Globe and Mail
</li><li>Bitcoin…","(Kitco News) The escalating Russia-Ukraine crisis, new sanctions, and surging oil prices have investors fleeing risk-on assets. And the crypto space is getting its safe-haven appeal back as more peop… [+3790 chars]",2022-03-01,en
"Stablecoins gain as bitcoin, ether fall after Russia invades Ukraine - Reuters","Stablecoins, which are virtual tokens pegged to traditional currencies such as the U.S. dollar, held gains on Thursday in the midst of a sell-off in risk assets such as stocks and bitcoin after Russia launched a full-scale invasion of Ukraine.","NEW YORK, Feb 24 (Reuters) - Stablecoins, which are virtual tokens pegged to traditional currencies such as the U.S. dollar, held gains on Thursday in the midst of a sell-off in risk assets such as s… [+2685 chars]",2022-02-24,en
Crypto evangelist Michael Saylor says bitcoin is the only scarcity in the world and snubs gold and 'everything else' as commodities that can be manufactured indefinitely,"""Given enough money and time, I can create infinite of any"" commodity, including gold, real estate, and luxury watches, said Michael Saylor.","The only scarcity in the world is bitcoin, and everything else including gold can be created indefinitely, according to crypto evangelist Michael Saylor.
In an interview on the PBD Podcast, the chie… [+1679 chars]",2022-03-09,en
Cryptoverse: The young HODLers keeping bitcoin on an even keel - Reuters.com,Bitcoin's been known to freak out when Elon Musk tweets a broken-heart emoji. So why isn't it flying off the handle as we seem to stand on the precipice of World War 3?,"March 8 (Reuters) - Bitcoin's been known to freak out when Elon Musk tweets a broken-heart emoji. So why isn't it flying off the handle as we seem to stand on the precipice of World War 3?
That coul… [+4696 chars]",2022-03-08,en
Bitcoin's true colours shine in stampede to safety - Reuters,Adversity tends to reveal true character. It’s certainly doing so for bitcoin. A rocky period for equities this year and the more recent escalation of geopolitical tensions are making it clearer that cryptocurrency is neither a decent hedge against a slumping…,"LONDON, Feb 23 (Reuters Breakingviews) - Adversity tends to reveal true character. Its certainly doing so for bitcoin. A rocky period for equities this year and the more recent escalation of geopolit… [+2224 chars]",2022-02-23,en
